{
  "@context": "../../ontology/context.jsonld",
  "smetp_kg_version": "0.1.0",
  "id": "kg:finance/credit-risk-assessment",
  "domain": "finance",
  "title": "Credit Risk Assessment (illustrative)",
  "experts": [
    {
      "id": "ex:jane-doe",
      "name": "Jane Doe",
      "role": "Senior Credit Analyst",
      "years_experience": 20
    },
    {
      "id": "ex:sam-rivera",
      "name": "Sam Rivera",
      "role": "Underwriting Manager",
      "years_experience": 14
    }
  ],
  "sessions": [
    {
      "id": "ses:jane-2025-01-15",
      "expert": "ex:jane-doe",
      "method": [
        "CDM"
      ],
      "date": "2025-01-15",
      "duration_min": 75
    },
    {
      "id": "ses:sam-2025-02-03",
      "expert": "ex:sam-rivera",
      "method": [
        "ACTA"
      ],
      "date": "2025-02-03",
      "duration_min": 40
    }
  ],
  "sources": [
    {
      "id": "src:jane-transcript",
      "kind": "transcript",
      "title": "Jane Doe interview transcript",
      "session": "ses:jane-2025-01-15",
      "sha256": "bd2856db4612190b6c203a9cd98398ace621729a5bb556f5245cf71ca136120c",
      "text": "[Illustrative transcript. Fictional SME. Session ses:jane-2025-01-15, Critical Decision Method.]\n\nInterviewer: Walk me through the first thing you look at.\nJane: Score first, always. Anything at 750 or above is prime and I approve it outright; I'm about 98 percent sure on those.\nInterviewer: And below 750?\nJane: 650 is my floor for the standard tier. Under 650 we're in subprime territory and it's a different conversation.\nInterviewer: What comes after score?\nJane: Debt-to-income. I take total monthly debt payments divided by gross monthly income. For standard tier I want DTI at 43 percent or lower.\nInterviewer: Employment?\nJane: Two years in the current job is my minimum for standard.\nJane: Then inquiries. One hard inquiry in six months is normal life. More than one and the file goes conditional, I'd put myself at 75 percent: I ask them to explain the inquiries and I usually offer a smaller amount.\nJane: Three or more hard inquiries in six months and I read it as desperation for credit. I reject unless there's a strong compensating factor.\nJane: If everything clears, score at or above 650, DTI at or under 43, two years on the job, at most one inquiry, it's a standard approval and I'm 92 percent sure.\nInterviewer: Anything that softens a borderline file?\nJane: Savings. Six months of expenses in the bank and I take about ten percent off my risk read. It's their safety net if the job goes.\nJane: Medical debt I only count at half toward DTI. People pay medical bills off; card debt means they overspend.\nJane: Married co-applicants are more stable than couples who are just dating, so I lean on a spouse's income more.\nJane: Young people, say 25 to 35, with income climbing fast, I'll approve even with a lower score.\nInterviewer: Bankruptcy?\nJane: If the discharge was seven or more years ago and the rest of the file is strong, it's approvable. The Fair Credit Reporting Act says bankruptcies drop off after seven years anyway.\nInterviewer: What don't you decide?\nJane: Rates. I never set the interest rate; pricing is a separate desk and I stay out of it.\n",
      "visibility": "public"
    },
    {
      "id": "src:sam-transcript",
      "kind": "transcript",
      "title": "Sam Rivera interview transcript",
      "session": "ses:sam-2025-02-03",
      "sha256": "c6e2dad25bcff9f5d8bc65b41b7ed3a6b65260eab778082d8466fa55fcaded22",
      "text": "[Illustrative transcript. Fictional SME. Session ses:sam-2025-02-03, Applied Cognitive Task Analysis.]\n\nInterviewer: Where do junior underwriters get self-employed applicants wrong?\nSam: They read year-to-date or the 1099s. For self-employed income I use the two-year average from the tax returns, nothing else.\nSam: And the two-year job rule doesn't apply to them as written. I want three years of self-employment history before I treat it like a W-2 job.\n",
      "visibility": "public"
    }
  ],
  "spans": [
    {
      "id": "sp:j-prime",
      "source": "src:jane-transcript",
      "start": 183,
      "end": 279,
      "sha256": "ed4a1b777cda48502e417e35038575c7876ea33e8652b8e61cf6bb1d7e9796f9",
      "quote": "Anything at 750 or above is prime and I approve it outright; I'm about 98 percent sure on those."
    },
    {
      "id": "sp:j-floor",
      "source": "src:jane-transcript",
      "start": 314,
      "end": 390,
      "sha256": "6ab4cdcf9911d3323a308b35365a7db0c79054b8adab5225cec6df1de0df3e16",
      "quote": "650 is my floor for the standard tier. Under 650 we're in subprime territory"
    },
    {
      "id": "sp:j-dti-def",
      "source": "src:jane-transcript",
      "start": 485,
      "end": 552,
      "sha256": "764d95d0e2b9c64caaaca403ddf8e8993afb8a83ae3d34836348ee1678875b2b",
      "quote": "I take total monthly debt payments divided by gross monthly income."
    },
    {
      "id": "sp:j-dti-max",
      "source": "src:jane-transcript",
      "start": 553,
      "end": 605,
      "sha256": "a0c31d6c824a65f673ddd8d05a66ddb6de7ce6f44bfc7e96c5659ca9ce75e393",
      "quote": "For standard tier I want DTI at 43 percent or lower."
    },
    {
      "id": "sp:j-emp",
      "source": "src:jane-transcript",
      "start": 637,
      "end": 693,
      "sha256": "1169f93dc37143384b190157af9cf68e31d9eb7c0bc13d01da75dd24a4c8c10d",
      "quote": "Two years in the current job is my minimum for standard."
    },
    {
      "id": "sp:j-inq-cond",
      "source": "src:jane-transcript",
      "start": 763,
      "end": 911,
      "sha256": "b448cbbd0631f0f940f3980ad333ec76e246ffb7ec61742f559eeffc807ef411",
      "quote": "More than one and the file goes conditional, I'd put myself at 75 percent: I ask them to explain the inquiries and I usually offer a smaller amount."
    },
    {
      "id": "sp:j-inq-desp",
      "source": "src:jane-transcript",
      "start": 918,
      "end": 1055,
      "sha256": "3221a55260eccb1d638fba678b83504a41c2ae6df336c613038991a600271004",
      "quote": "Three or more hard inquiries in six months and I read it as desperation for credit. I reject unless there's a strong compensating factor."
    },
    {
      "id": "sp:j-std",
      "source": "src:jane-transcript",
      "start": 1062,
      "end": 1219,
      "sha256": "fd3ac31fde84874186b9bf4aa0ccf859f4bfdb8b80f9f7a8129d4fcda1e7d20d",
      "quote": "If everything clears, score at or above 650, DTI at or under 43, two years on the job, at most one inquiry, it's a standard approval and I'm 92 percent sure."
    },
    {
      "id": "sp:j-sav",
      "source": "src:jane-transcript",
      "start": 1289,
      "end": 1370,
      "sha256": "5ba9d646261fe050c6e02903ee5d8a5069071b8530008585f8bc7aad90d9e675",
      "quote": "Six months of expenses in the bank and I take about ten percent off my risk read."
    },
    {
      "id": "sp:j-med",
      "source": "src:jane-transcript",
      "start": 1416,
      "end": 1461,
      "sha256": "648e6a01abf28e2967af261d637fe80e745819404ae22192b840ddcf9da8cc43",
      "quote": "Medical debt I only count at half toward DTI."
    },
    {
      "id": "sp:j-married",
      "source": "src:jane-transcript",
      "start": 1530,
      "end": 1638,
      "sha256": "bd348ad6505601d2edd5a575deb7172c5396a396134c30a6077465a30f81a736",
      "quote": "Married co-applicants are more stable than couples who are just dating, so I lean on a spouse's income more."
    },
    {
      "id": "sp:j-age",
      "source": "src:jane-transcript",
      "start": 1645,
      "end": 1737,
      "sha256": "2b26c88069592cf8062763bc722f37f227092498ed8cb0c56a0d2437477d1cbc",
      "quote": "Young people, say 25 to 35, with income climbing fast, I'll approve even with a lower score."
    },
    {
      "id": "sp:j-bk",
      "source": "src:jane-transcript",
      "start": 1769,
      "end": 1866,
      "sha256": "2902266cc84846ce28569b2055e980f6aefbd4a3a9e7ef531c74038043315e09",
      "quote": "If the discharge was seven or more years ago and the rest of the file is strong, it's approvable."
    },
    {
      "id": "sp:j-bk-why",
      "source": "src:jane-transcript",
      "start": 1867,
      "end": 1949,
      "sha256": "5c8949d03c7e9e2e02b15e1c079552d918e8caa60e6745972a336269bdda63ff",
      "quote": "The Fair Credit Reporting Act says bankruptcies drop off after seven years anyway."
    },
    {
      "id": "sp:s-avg",
      "source": "src:sam-transcript",
      "start": 224,
      "end": 311,
      "sha256": "7057a81893ee8a5a0c9d21837da084e6e09ffbe6c786e21a39f1de2e6b68812b",
      "quote": "For self-employed income I use the two-year average from the tax returns, nothing else."
    },
    {
      "id": "sp:s-tenure",
      "source": "src:sam-transcript",
      "start": 377,
      "end": 456,
      "sha256": "93ca80a8a402257057f492bd6f922780bab945e24ea2809a0bf172dab7442e54",
      "quote": "I want three years of self-employment history before I treat it like a W-2 job."
    },
    {
      "id": "sp:j-pricing",
      "source": "src:jane-transcript",
      "start": 1999,
      "end": 2078,
      "sha256": "0617f2169e0f83ca55d1a0af971a39f91dce9f08658d26443424c18f2590549d",
      "quote": "I never set the interest rate; pricing is a separate desk and I stay out of it."
    }
  ],
  "concepts": [
    {
      "id": "k:credit-score",
      "label": "Credit score",
      "alt_labels": [
        "FICO score",
        "score"
      ],
      "notation": [
        "FICO"
      ],
      "definition": "Bureau credit score on the 300 to 850 FICO scale.",
      "unit": "points"
    },
    {
      "id": "k:dti",
      "label": "Debt-to-income ratio",
      "alt_labels": [
        "debt to income",
        "debt-to-income"
      ],
      "notation": [
        "DTI"
      ],
      "definition": "Total monthly debt payments divided by gross monthly income.",
      "unit": "ratio",
      "depends_on": [
        "k:monthly-debt",
        "k:gross-monthly-income"
      ]